989,Счета на оплату,Оплата по подписке,МБ,iOS,до 3.23,Как оплатить штраф или налог,,,,На экране «Платежи» нажмите «Оплата услуг»,Выберите «Штрафы и налоги»,Выберите «Штрафы ГИБДД» или «Налоги ФНС»,Выберите «Оплатить по постановлению» или «Оплатить по индексу документа»,Укажите номер постановления и нажмите «Проверить»,,,,,,,
990,Счета на оплату,Оплата по подписке,МБ,Android,до 2.43,Как оплатить штраф или налог,,,,На экране «Платежи» нажмите «Оплата услуг»,Выберите «Штрафы и налоги»,Выберите «Штрафы ГИБДД» или «Налоги ФНС»,Выберите «Оплатить по постановлению» или «Оплатить по индексу документа»,Укажите номер постановления и нажмите «Проверить»,,,,,,,
991,Счета на оплату,Оплата по подписке,МБ,Android,2.43 и выше,Как оплатить штраф или налог по квитанции,,,,На экране «Платежи» выберите в разделе «Оплата услуг» выберите «Штрафы и налоги»,"Выберите «Штрафы ГИБДД», «Налоги ФНС» или другую инстанцию",Выберите «По документам» или «По квитанции»,"Если оплачиваете счет по документу, добавьте его номер и нажмите «Сохранить и проверить».

Если оплачиваете счет по квитанции, укажите УИН и нажмите «Проверить»",,,,,,,,
992,Счета на оплату,Мои документы,МБ,Android,до 2.54,"Как удалить документ, по которому я получаю уведомления о счетах, штрафах и налогах",,,,На экране «Профиль» нажмите «Мои документы»,"Выберите из списка документ, который хотите удалить и нажмите на него",Нажмите на значок корзины в верхнем правом углу,"Подтвердите, что хотите удалить документ — нажмите «Удалить». Вместе с документом также будут удалены все счета, которые по нему приходили",,,,,,,,
993,Счета на оплату,Мои документы,МБ,iOS,2.86 и выше,"Как удалить документ, по которому я получаю уведомления о счетах, штрафах и налогах",,,,На экране «Профиль» нажмите «Мои документы»,"Выберите из списка документ, который хотите удалить и нажмите на него",Нажмите на значок корзины в верхнем правом углу,"Подтвердите, что хотите удалить документ — нажмите «Удалить». Вместе с документом такж будут удалены все счета, которые по нему приходили",,,,,,,,
994,Счета на оплату,Все счета на оплату,ИБ,,,Как посмотреть все мои счета на оплату,,,,Перейдите на вкладки «Мои продукты» или «Платежи и переводы»,"Перейдите в раздел «Счета на оплату» и нажмите на стрелку справа, чтобы посмотреть все счета.","На экране отобразятся все счета на оплату, которые пришли по добавленным вами документам: новые и уже оплаченные.",,,,,,,,,
995,Счета на оплату,Мои документы,ИБ,,,"Как удалить документ, по которому приходят счета на оплату",,,,Перейдите в раздел «Профиль»: нажмите на имя или иконку шестеренки в верхнем правом углу.,Перейдите в раздел «Мои документы».,"Наведите курсор на карточку документа.
",Нажмите на иконку с корзиной.,Нажмите «Удалить».,Документ удален.,,,,,,
996,Текущие счета,Счет эскроу,ИБ,,,Как пополнить счет эскроу,,,,В блоке «Счета» в разделе «Мои продукты» выберите «Текущие». Выберите нужный счет эскроу и нажмите «Пополнить».,"Выберите карту или счет, с которой хотите перевести деньги.

Примечание: Если клиент не предоставил банку договор долевого участия с отметками о регистрации в Росреестре, но пытается пополнить счет, то он увидит подсказку и сможет из нее перейти на сайт, чтобы записаться в офис для предоставления договора.","Введите сумму и нажмите «Перевести».

Примечание: Платеж не пройдет, если сумма на эскроу-счете уже превышает стоимость объекта недвижимости. Также платеж не пройдет если клиент пытается перевести на эскроу-счет сумму большую, чем это возможно. В этом случае подсказываем, на какую еще сумму можно пополнить эскроу-счет.",Нажмите «Подтвердить».,Нажмите «Готово». ,,,,,,,
997,Текущие счета,Закрытие текущего счета,ИБ,,,Как закрыть текущий счет,,,,На экране «Мои продукты» в разделе «Счета» найдите нужный текущий счет.,Нажмите «Закрыть счет».,"Выберите, куда перевести деньги со счета.",Подтвердите действие SMS-кодом.,Счет закрыт и больше не будет отображаться в мобильном и интернет-банке.,,,,,,,
998,Текущие счета,Закрытие счета,МБ,iOS,2.89 и выше,Как закрыть текущий счет,,,,На экране «Мои деньги» в разделе «Счета» найдите нужный счет и нажмите на него.,Перейдите в раздел «Настройки» и выберите «Закрыть счет».,"Выберите, куда перевести деньги со счета.",Нажмите «Закрыть счет».,,,,,,,,
999,Текущие счета,Закрытие счета,МБ,Android,2.40 и выше,Как закрыть текущий счет,,,,На экране «Мои деньги» в разделе «Счета» найдите нужный счет и нажмите на него.,Перейдите в раздел «Информация о счете» и выберите «Закрыть счет».,"Выберите, куда перевести деньги со счета.",Нажмите «Закрыть счет».,Подтвердите закрытие SMS-кодом.,,,,,,,
1000,Уведомления,Push-уведомления,МБ,All,,Как посмотреть историю push-уведомлений от банка,,,,Нажмите на колокольчик в верхнем правом углу на экране «Мои деньги».,"На экране отобразится история push-уведомлений, если в качестве способа получения вы выбрали Push или Push Pro. Уведомления расположены в хронологическом порядке, для каждой операции указаны дата и время.",,,,,,,,,,
1001,Уведомления,Push-уведомления,ИБ,,,Как посмотреть историю push-уведомлений от банка,,,,Историю push-уведомлений можно посмотреть только в мобильном приложении.,,,,,,,,,,,
1002,Шаблоны,Просмотр шаблонов,МБ,iOS,до 4.05,Как посмотреть список моих шаблонов,,https://www.open.ru/services/payments#614,,На экране «Мои деньги» пролистайте поле «Мои шаблоны» до кнопки «Все шаблоны».,Нажмите «Все шаблоны».,На экране отобразится список всех шаблонов.,,,,,,,,,
1003,Шаблоны,Просмотр шаблонов,МБ,Android,2.73 и выше,Как посмотреть список моих шаблонов,,https://www.open.ru/services/payments#614,,На экране «Платежи» пролистайте поле «Шаблоны» до кнопки «Все шаблоны».,Нажмите «Все шаблоны».,На экране отобразится список всех шаблонов.,,,,,,,,,
1004,Шаблоны,Просмотр шаблонов,МБ,Android,до 2.73,Как посмотреть список моих шаблонов,,https://www.open.ru/services/payments#614,,На экране «Мои деньги» или на экране «Платежи» пролистайте поле «Шаблоны» до кнопки «Все шаблоны».,Нажмите «Все шаблоны».,На экране отобразится список всех шаблонов.,,,,,,,,,
1005,Шаблоны,Просмотр шаблонов,ИБ,,,Как посмотреть список моих шаблонов,,https://www.open.ru/services/payments#614,,Перейдите на вкладку «Мои продукты» или «Платежи и переводы».,"Перейдите раздел «Шаблоны» и нажмите на стрелку справа, чтобы посмотреть все шаблоны.",На экране появится список всех шаблонов.,,,,,,,,,
1006,Шаблоны,Создание шаблона,МБ,All,,Как создать шаблон из истории операций,https://youtu.be/zwunbSoUf88,https://www.open.ru/services/payments#613 https://www.open.ru/mobile_open_ru#2277 ,,На экране «Платежи» выберите нужную операцию в истории операций и нажмите на нее.,Нажмите «Создать шаблон».,Введите название шаблона и нажмите «Создать».,Шаблон успешно создан.,,,,,,,,
1007,Шаблоны,Создание шаблона,ИБ,,,Как создать шаблон из истории операций,,https://www.open.ru/services/payments#613 https://www.open.ru/internetbank#2306,,Перейдите на вкладку «История операций».,Перейдите в раздел «В интернет-банке» — снизу отобразится история операций по всем продуктам.,Выберите нужную операцию из списка и нажмите на нее.,Внизу окна нажмите «Шаблон».,Придумайте имя шаблона и нажмите «Сохранить».,Шаблон успешно создан.,,,,,,
1008,Шаблоны,Создание шаблона,МБ,All,,Как создать шаблон после совершения платежа или перевода,,https://www.open.ru/mobile_open_ru#2277 ,,Совершите нужный платеж. После совершения платежа или перевода нажмите «Создать шаблон».,Введите название шаблона и нажмите «Создать».,Шаблон создан.,,,,,,,,,
1009,Шаблоны,Создание шаблона,ИБ,,,Как создать шаблон после совершения платежа или перевода,,https://www.open.ru/internetbank#2306,,После совершения платежа или перевода нажмите «Шаблон».,Введите название шаблона и нажмите «Сохранить».,Шаблон сохранен.,,,,,,,,,
1010,Шаблоны,Изменение шаблона,МБ,All,,Как изменить шаблон или регулярный платеж,,https://www.open.ru/services/payments#615,,В слайдере на экране «Мои деньги» пролистайте поле «Мои шаблоны» до кнопки «Все шаблоны» и нажмите ее.,Нажмите «Изменить» в верхнем правом углу экрана.,Нажмите на нужный шаблон.,Измените данные и нажмите «Сохранить».,Нажмите «Да».,,,,,,,
1011,Шаблоны,Изменение шаблона,МБ,iOS,до 4.05,Как изменить шаблон,,https://www.open.ru/services/payments#615,,В слайдере на экране «Мои деньги» пролистайте поле «Мои шаблоны» до кнопки «Все шаблоны» и нажмите ее.,Нажмите «Изменить» в верхнем правом углу экрана.,Нажмите на нужный шаблон.,Измените данные и нажмите «Сохранить».,Нажмите «Да».,,,,,,,
1012,Шаблоны,Изменение шаблона,ИБ,,,Как изменить шаблон,,https://www.open.ru/services/payments#615,,На вкладке «Мои продукты» или «Платежи и переводы» перейдите в раздел «Шаблоны» и нажмите нажмите на стрелку справа.,Нажмите на иконку карандаша справа от названия нужного шаблона.,Измените данные и нажмите «Сохранить».,Шаблон успешно отредактирован.,,,,,,,,
1013,Шаблоны,Удаление шаблона,МБ,iOS,до 4.05,Как удалить шаблон,,https://www.open.ru/services/payments#616,,В слайдере на экране «Мои деньги» пролистайте поле «Мои шаблоны» до кнопки «Все шаблоны» и нажмите ее,Нажмите «Изменить».,Нажмите на нужный шаблон.,Нажмите на иконку корзины в верхнем правом углу.,Нажмите «Удалить».,,,,,,,
1014,Шаблоны,Удаление шаблона,МБ,Android,2.73 и выше,Как удалить шаблон,,https://www.open.ru/services/payments#616,,В слайдере на экране «Платежи» пролистайте поле «Шаблоны» до кнопки «Все шаблоны» и нажмите ее,Нажмите «Изменить».,Нажмите на нужный шаблон.,Нажмите на иконку корзины в верхнем правом углу.,Нажмите «Удалить».,,,,,,,
1015,Шаблоны,Удаление шаблона,МБ,Android,до 2.73,Как удалить шаблон,,https://www.open.ru/services/payments#616,,На экране «Мои деньги» или на экране «Платежи» пролистайте поле «Шаблоны» до кнопки «Все шаблоны».,"Нажмите на иконку в правом верхнем углу, затем ― «Изменить шаблон».","Выберите шаблон, который хотите удалить.",Нажмите на иконку корзины в верхнем правом углу.,Нажмите «Удалить».,,,,,,,
1016,Шаблоны,Удаление шаблона,ИБ,,,Как удалить шаблон,,https://www.open.ru/services/payments#616,,"На вкладке «Мои продукты» или «Платежи и переводы» перейдите в раздел «Шаблоны» и нажмите на стрелку справа, чтобы посмотреть все шаблоны.",Нажмите на иконку с корзиной справа от названия шаблона.,Нажмите «Удалить».,Шаблон исчезнет из списка.,,,,,,,,
1017,Шаблоны,История операций,МБ,All,,Как создать шаблон,https://youtu.be/zwunbSoUf88,https://www.open.ru/services/payments#613,,На экране «Платежи» выберите нужную операцию в истории операций и потяните ее справа налево.,Нажмите «Создать шаблон».,Задайте название шаблона и нажмите «Создать».,,,,,,,,,
1018,Шаблоны,Удаление шаблона,МБ,All,,Как удалить шаблон свайпом,,,,На экране «Мои деньги» пролистайте раздел «Мои шаблоны» до кнопки «Все шаблоны» и нажмите на нее.,"Выберите шаблон, который хотите удалить, и потяните его справа налево.",Нажмите «Удалить».,Еще раз нажмите «Удалить».,,,,,,,,
1019,Шаблоны,Удаление шаблона,МБ,iOS,до 4.05,Как изменить шаблон или регулярный платеж свайпом,,https://www.open.ru/services/payments#615,,На экране «Мои деньги» пролистайте раздел «Мои шаблоны» до кнопки «Все шаблоны» и нажмите на нее.,"Выберите шаблон, который хотите изменить, и потяните его справа налево.",Нажмите «Изменить».,Внесите изменения и нажмите «Сохранить».,,,,,,,,
1020,Шаблоны,Удаление шаблона,МБ,Android,2.73 и выше,Как изменить шаблон или регулярный платеж свайпом,,https://www.open.ru/services/payments#615,,На экране «Платежи» пролистайте раздел «Шаблоны» до кнопки «Все шаблоны» и нажмите на нее.,"Выберите шаблон, который хотите изменить, и потяните его справа налево.",Нажмите «Изменить».,Внесите изменения и нажмите «Сохранить».,,,,,,,,
1021,Шаблоны,Удаление шаблона,МБ,Android,до 2.73,Как изменить шаблон или регулярный платеж свайпом,,https://www.open.ru/services/payments#615,,На экране «Мои деньги» или на экране «Платежи» пролистайте поле «Шаблоны» до кнопки «Все шаблоны».,"Нажмите на иконку в правом верхнем углу, затем ― «Изменить шаблон».","Выберите шаблон, который хотите изменить.",Внесите изменения и нажмите «Сохранить».,Подтвердите изменения ― нажмите «Да».,,,,,,,
1022,Шаблоны,Удаление шаблона,МБ,iOS,до 4.05,Как изменить шаблон свайпом,,https://www.open.ru/services/payments#615,,На экране «Мои деньги» пролистайте раздел «Шаблоны» до кнопки «Все шаблоны» и нажмите на нее.,"Выберите шаблон, который хотите изменить, и потяните его справа налево.",Нажмите «Изменить».,Внесите изменения и нажмите «Сохранить».,,,,,,,,
1023,Шаблоны,Создание шаблона,ИБ,,,Как создать шаблон,,https://www.open.ru/services/payments#613 https://www.open.ru/internetbank#2306 ,https://www.open.ru/services/payments,Перейдите на вкладку «Мои продукты» или «Платежи и переводы».,В разделе «Шаблоны» в верхней части страницы нажмите на кнопку с иконкой «+».,"Выберите, для какого платежа или перевода хотите создать шаблон. Можно выбрать категорию из списка или использовать поиск по названию или ИНН.","Введите данные платежа или перевода, укажите сумму и введите название шаблона.","Если хотите просто сохранить шаблон, нажмите «Сохранить шаблон». Если хотите сохранить шаблон и одновременно совершить платеж по нему, нажмите «Сохранить и оплатить».",Для оплаты еще раз введите сумму платежа и нажмите «Оплатить».,Подтвердите оплату SMS-кодом.,,,,,
1024,Шаблоны,Сортировка шаблонов,ИБ,,,Как отсортировать шаблоны,,,,Перейдите на вкладки «Мои продукты» или «Платежи и переводы».,"Перейдите в раздел «Шаблоны» и нажмите на стрелку справа, чтобы посмотреть все шаблоны.","Наведите курсор на шаблон, который хотите переместить, а затем нажмите на иконку перемещения и, удерживая ее, переместите шаблон в нужное место.",,,,,,,,,
1025,Шаблоны,Сортировка шаблонов,МБ,Android,до 2.73,Как отсортировать шаблоны,,,,На экране «Мои деньги» или на экране «Платежи» пролистайте поле «Шаблоны» до кнопки «Все шаблоны».,"Нажмите на иконку в правом верхнем углу, затем ― «Последовательность».","Поменяйте порядок шаблонов: нажмите на шаблон, который хотите переместить и, удерживая его, переместите в нужное место.","Нажмите на галочку в верхнем правом углу, чтобы сохранить новый порядок шаблонов в списке.",,,,,,,,
1026,Шаблоны,Все шаблоны,ИБ,,,Как посмотреть все мои шаблоны,,,,Перейдите на вкладки «Мои продукты» или «Платежи и переводы».,"Перейдите в раздел «Шаблоны» и нажмите на стрелку справа, чтобы посмотреть все шаблоны.","На экране отобразятся все созданные шаблоны. Их можно изменить, отсортировать или удалить.",,,,,,,,,
1027,Шаблоны,Без совершения операции,МБ,Android,2.40 и выше,"Как создать шаблон платежа, не совершая операцию",,https://www.open.ru/services/payments#613,, На экране «Мои деньги» пролистайте блок с шаблонам до кнопки «Все шаблоны» и нажмите на кнопку «+».,"Выберите, для какого платежа хотите создать шаблон. Можно выбрать категорию из списка или воспользоваться поиском.",Введите данные платежа.,На экране «Мои деньги» или на экране «Платежи» пролистайте блок с шаблонам до кнопки «Все шаблоны» и нажмите на кнопку «+».,,,,,,,,
