   №,ПРОДУКТ / УСЛУГА ,ОПЕРАЦИЯ,ДБО,ОС,ВЕРСИЯ,ВОПРОС,Видео-инструкция,Инструкция в FAQ,"Инструкция 
на сайте",1,2,3,4,5,6,7,8,9,10,11,12
1,Автоплатежи,Создание автоплатежа,МБ,Android,,Как настроить автоплатеж по расписанию после совершения операции,,https://www.open.ru/services/payments#2441 https://mobile.open.ru/#2276 https://www.open.ru/deposits/savings_account/faq#1216,"https://mobile.open.ru#1140
https://www.open.ru/services/payments#2441","Совершите любой нужный платеж или перевод (кроме перевода с чужой карты на свою и переводов по номеру телефона, а также многоэтапных платежей) и нажмите «Создать автоплатеж».",Введите название платежа и сумму.,Выберите частоту и срок действия платежа и нажмите «Подключить».,Подтвердите создание автоплатежа SMS-кодом.,Автоплатеж создан.,,,,,,,
2,Автоплатежи,Создание автоплатежа,МБ,iOS,,Как настроить автоплатеж по расписанию после совершения операции,,"https://mobile.open.ru/#2276  https://www.open.ru/deposits/savings_account/faq#1216
https://www.open.ru/services/payments#2441","https://mobile.open.ru#1140
https://www.open.ru/services/payments#2441","Совершите любой нужный платеж или перевод (кроме перевода с чужой карты на свою и переводов по номеру телефона, а также многоэтапных платежей) и нажмите «Создать автоплатеж».",Введите название автоплатежа и сумму.,Выберите частоту и срок действия платежа и нажмите «Сохранить».,Подтвердите создание автоплатежа SMS-кодом.,Автоплатеж создан.,"Настроеные автоплатеж можно посмотреть, отредактировать или удалить в разделе «Автоплатежи» на экране «Платежи и переводы».",,,,,,
3,Автоплатежи,Создание автоплатежа по расписанию,ИБ,,,Как настроить автоплатеж по расписанию из истории операций,,https://www.open.ru/services/payments#2441 https://www.open.ru/internetbank#2307  https://www.open.ru/deposits/savings_account/faq#1216,"https://www.open.ru/internetbank#2307
https://www.open.ru/services/payments#2441",Перейдите на вкладку «История операций».,Перейдите в раздел «В интернет-банке» — снизу отобразится история операция по всем продуктам.,Выберите в списке нужную операцию (кроме перевода с чужой карты на свою и переводов по номеру телефона) и нажмите на нее.,Нажмите «Автоплатеж».,"Введите название автоплатежа, сумму и укажите периодичность, с которой его нужно совершать: один раз, ежедневно, раз в неделю или раз в месяц. Если необходимо, уточните дату или период.",Подтвердите создание автоплатежа SMS-кодом.,Автоплатеж создан.,,,,,
4,Автоплатежи,Создание автоплатежа по расписанию,ИБ,,,Как настроить автоплатеж по расписанию после совершения операции,,https://www.open.ru/services/payments#2441 https://www.open.ru/internetbank#2307 ,"https://www.open.ru/internetbank#2307
https://www.open.ru/services/payments#2441","Cовершите любой платеж (кроме перевода с чужой карты на свою и переводов по номеру телефона, а также многоэтапных платежей), нажмите «Автоплатеж».",Перейдите на вкладку «По расписанию».,"Введите название автоплатежа, сумму и укажите периодичность, с которой его нужно совершать: один раз, ежедневно, раз в неделю или раз в месяц. Если необходимо, уточните дату или период.",Подтвердите создание автоплатежа SMS-кодом.,Автоплатеж создан.,,,,,,,
5,Автоплатежи,Изменение автоплатежа,МБ,iOS,2.93 и выше,Как изменить автоплатеж,,,,Перейдите на экран «Платежи и переводы».,Нажмите «Автоплатежи».,"Выберите автоплатеж, который хотите изменить и нажмите на него.",Внесите необходимые изменения и нажмите «Сохранить изменения».,Подтвердите изменение автоплатежа SMS-кодом.,Автоплатеж успешно создан.,,,,,,
6,Автоплатежи,Удаление автоплатежа,МБ,iOS,2.93 и выше,Как удалить автоплатеж,,,,Перейдите на экран «Платежи и переводы».,Нажмите «Автоплатежи».,"Найдите автоплатеж, который хотите удалить. Для быстрого удаления проведите по нему справа налево и подтвердите удаление. 
 
Если перед удалением хотите ознакомиться с деталями платежа, нажмите на него.",Нажмите на иконку корзины в верхнем правом углу.,"Подтвердите, что хотите удалить автоплатеж — нажмите «Удалить».",,,,,,,
7,Автоплатежи,Создание ежедневного автоплатежа,ИБ,,,Как настроить ежедневный автоплатеж,,,,После совершения платежа или перевода нажмите «Автоплатеж».,На вкладке «По расписанию» введите название автоплатежа и сумму.,В после «Повторять» выберите «Ежедневно».,"Выберите, сколько автоплатеж должен действовать: бессрочно, до определенной даты или один раз.",Нажмите сохранить.,Подтвердите создание автоплатежа SMS-кодом.,"Автоплатеж создан. Посмотреть, изменить или удалить его можно в разделе «Автоплатежи» во вкладках «Мои продукты», «Переводы» и «Платежи».",,,,,
8,Автоплатежи,Изменение автоплатежа,ИБ,,,Как изменить автоплатеж,,,,Перейдите на вкладки «Мои продукты» или «Платежи и переводы».,"Перейдите в раздел «Автоплатежи» и нажмите на стрелку справа, чтобы посмотреть все автоплатежи.",Выберите нужный автоплатеж и нажмите на него.,Нажмите на иконку карандаша справа от названия автоплатежа.,Внестие необходимые измнения и нажмите «Сохранить».,Автоплатеж сохранен.,,,,,,
9,Автоплатежи,Удаление автоплатежа,ИБ,,,Как удалить автоплатеж,,,,Перейдите на вкладки «Мои продукты» или «Платежи и переводы».,"Перейдите в раздел «Автоплатежи» и нажмите на стрелку справа, чтобы посмотреть все автоплатежи.",Найдите нужный автоплатеж в списке.,Нажмите на иконку корзины справа от названия автоплатежа.,Нажимите «Удалить».,Автоплатеж удален.,,,,,,
10,Автоплатежи,Создание автоплатежа по выставленному счету,ИБ,,,Как настроить автоплатеж при выставленнии счета,,,,"На вкладке «История операций» найдите оплаченный счет, по которому хотите настроить автоплатеж и нажмите на него.",Нажмите «Автоплатеж».,На вкладке «При выставлении счета» укажите название автоплатежа и максимальну сумму одного платежа.,Нажмите «Подключить».,Введите SMS-код для подтверждения.,"Заявка на создание автоплатежа принята. Вы получите SMS или push-уведомление, как автплатеж будет подключен. 
 
 В следующий раз счет указанным в автоплатеже реквизитам будет оплачен автоматически.",,,,,,
11,Автоплатежи,Создание автоплатежа,МБ,All,,Как настроить автоплатеж по расписанию из истории операций,,https://www.open.ru/services/payments#2441 https://mobile.open.ru/#2276 https://www.open.ru/deposits/savings_account/faq#1216 ,"https://mobile.open.ru#1140
https://www.open.ru/services/payments#2441","В истории операций в разделе «Платежи и переводы» найдите операцию, для которой хотите создать автоплатеж и нажмите на нее.",Нажмите «Создать автоплатеж».,Введите название автоплатежа и сумму.,Выберите частоту и срок действия автоплатежа и нажмите «Подключить».,Подтвердите создание автоплатежа SMS-кодом.,Автоплатеж создан.,,,,,,
12,Автоплатежи,Удаление автоплатежа,МБ,Android,2.73 и выше,Как удалить автоплатеж,,,,Перейдите на экран «Платежи и переводы».,"В слайдере найдите раздел «Автоплатежи», пролистайте до кнопки «Все автоплатежи» и нажмите на нее.","Найдите автоплатеж, который хотите удалить. Для быстрого удаления проведите по нему справа налево и подтвердите удаление. 
 
Если перед удалением хотите ознакомиться с деталями платежа, нажмите на него.",Нажмите на иконку корзины в верхнем правом углу.,"Подтвердите, что хотите удалить автоплатеж — нажмите «Удалить».",,,,,,,
13,Автоплатежи,Удаление автоплатежа,МБ,Android,до 2.73,Как удалить автоплатеж,,,,Перейдите на экран «Платежи и переводы».,Нажмите «Автоплатежи» вверху экрана.,"Найдите автоплатеж, который хотите удалить, и нажмите на него.",Нажмите на иконку корзины в верхнем правом углу.,"Подтвердите, что хотите удалить автоплатеж — нажмите «Удалить».",,,,,,,
14,Автоплатежи,Изменение автоплатежа,МБ,Android,2.37 и выше,Как изменить автоплатеж,,,,Перейдите на экран «Платежи и переводы»,Нажмите «Автоплатежи»,"Выберите автоплатеж, который хотите изменить и нажмите на него.",Внесите необходимые изменения и нажмите «Сохранить изменения»,,,,,,,,
15,Автоплатежи,Сортировка автоплатежей,МБ,Android,до 2.73,Как отсортировать автоплатежи,,,,Перейдите на экран «Платежи и переводы»,Нажмите «Автоплатежи»,Нажмите на иконку в правом верхнем углу.,Нажмите «Последовательность»,"Поменяйте порядок автоплатежей: нажмите на автоплатеж, который хотите переместить и, удерживая его, переместите в нужное место.","Нажмите на галочку в верхнем правом углу, чтобы сохранить новый порядок автоплатежей в списке.",,,,,,
16,Автоплатежи,Сортировка автоплатежей,МБ,Android,2.73 и выше,Как отсортировать автоплатежи,,,,Перейдите на экран «Платежи и переводы»,В слайдере найдите раздел «Автоплатежи».,Пролистайте список автоплатежей до кнопки «Все автоплатежи» и нажмите на нее.,Откроется список всех автоплатежей. Нажмите на иконку в правом верхнем углу.,Нажмите «Последовательность»,"Поменяйте порядок автоплатежей: нажмите на автоплатеж, который хотите переместить и, удерживая его, переместите в нужное место.","Нажмите на галочку в верхнем правом углу, чтобы сохранить новый порядок автоплатежей в списке.",,,,,
17,Автоплатежи,Просмотр автоплатежей,ИБ,,,Как посмотреть все мои автоплатежи,,,,Перейдите на вкладки «Мои продукты» или «Платежи и переводы»,"Перейдите в раздел «Автоплатежи» и нажмите на стрелку справа, чтобы посмотреть все автоплатежи.",В новом окне отобразятся все созданные автоплатежи: завершенные и активные. Их можно изменить или удалить.,,,,,,,,,
18,Автоплатежи,История автоплатежа,ИБ,,,Как посмотреть историю платежей автоплатежей по расписанию,,,,Перейдите на вкладки «Мои продукты» или «Платежи и переводы»,"Перейдите в раздел «Автоплатежи» и нажмите на стрелку справа, чтобы посмотреть все автоплатежи.","Найдите нужный автоплатеж в списке и нажмите «Показать историю платежей» — снизу отобразятся все совершенные платежи. 
 
 Примечание: Историю платежей можно посмотреть для повторяющихся автоплатежей по расписанию, при выставлении счета и при снижении баланса мобильного телефона.",,,,,,,,,
19,Автоплатежи,Создание автоплатежа по выставленному счету,МБ,Android,2.39 и выше,Как настроить автоплатеж при выставленнии счета для оплаты ЖКУ,,https://www.open.ru/services/payments#2443,https://www.open.ru/services/payments#2443,"Оплатите услуги ЖКУ и после подтверждения платежа нажмите «Создать автоплатеж». Или выберите нужный платеж в истории операций, нажмите на него, а затем — «Создать автоплатеж».",Придумайте и введите название автоплатежа.,В разделе «Повторять» выберите «При выставлении счета».,Введите максимальную сумму платежа.,Нажмите «Подключить».,Введите SMS-код для подтверждения.,"Заявка на создание автоплатежа принята. Вы получите SMS или push-уведомление, как автплатеж будет подключен. 
 
В следующий раз счет по указанным в автоплатеже реквизитам будет оплачен автоматически.",,,,,
20,Автоплатежи,Создание автоплатежа с ежедневным повтором,МБ,Android,2.40 и выше,Как настроить автоплатеж по расписанию с ежедневным повтором,,,,"Совершите платеж или перевод и после подтверждения операции нажмите «Создать автоплатеж». Или выберите нужный платеж или перевод в истории операций, нажмите на него, а затем — «Создать автоплатеж».",Введите название платежа., В разделе «Повторять» выберите «Ежедневно».,"Выберите срок действия автоплатежа: бессрочно, несколько раз или до определенной даты.",Введите сумму платежа.,Нажмите «Подключить».,Подтвердите создание автоплатежа SMS-кодом.,,,,,
21,Автоплатежи,Создание автоплатежа по выставленному счету,МБ,iOS,2.94 и выше,Как настроить автоплатеж при выставлении счета для оплаты ЖКУ,,https://www.open.ru/services/payments#2443,https://www.open.ru/services/payments#2443,"Оплатите услуги ЖКУ и после подтверждения платежа нажмите «Создать автоплатеж». Или выберите нужный платеж в истории операций, нажмите на него, а затем — «Создать автоплатеж».",Придумайте и введите название автоплатежа.,В разделе «Повторять» выберите «При выставлении счета».,Введите максимальную сумму платежа.,Нажмите «Подключить».,Введите SMS-код для подтверждения.,"Заявка на создание автоплатежа принята. Вы получите SMS или push-уведомление, как автплатеж будет подключен. 
 
В следующий раз счет по указанным в автоплатеже реквизитам будет оплачен автоматически.",,,,,
22,Автоплатежи,Создание автоплатежа с ежедневным повтором,МБ,iOS,2.94 и выше,Как настроить автоплатеж по расписанию с ежедневным повтором,,,,Совершите платеж или выберите нужную операцию в истории операций.,Нажмите «Создать автоплатеж».,Введите название платежа.,В разделе «Повторять» выберите «Ежедневно».,"Выберите срок действия автоплатежа: бессрочно, несколько раз или до определенной даты.
",Введите сумму платежа.,Нажмите «Подключить».,Подтвердите создание автоплатежа SMS-кодом.,,,,
23,Онбординг,Операции в прелогин-зоне,МБ,iOS,3.07 и выше,"Что можно сделать, не регистрируясь в приложении",,,,"С экрана «Вход и регистрация» можно перейти к оформлению карты. Нажмите «Я еще не клиент», а затем — «Оформить карту». Откроется страница о карте Opencard на сайте банка.

На экране «Помощь» можно связаться со службой поддержки. Введите текст, чтобы начать чат, или в правом верхнем углу нажмите на иконку трубки, чтобы позвонить.

На экране «На карте» можно найти офисы и банкоматы «Открытия», а также банкоматы партнеров. Если неудобно искать на карте, выберите список.",,,,,,,,,,,
24,Онбординг,Операции в прелогин-зоне,МБ,Android,2.44 и выше,"Что можно сделать, не регистрируясь в приложении",,,,"С экрана «Вход и регистрация» можно перейти к оформлению карты. Нажмите «Я еще не клиент», а затем — «Оформить карту». Откроется страница о карте Opencard на сайте банка.

Связаться со службой поддержки. В правом нижнем углу нажмите на иконку чата, чтобы написать, или на иконку трубки, чтобы позвонить онлайн или по телефону.

Найти офисы и банкоматы «Открытия», а также банкоматы партнеров. В правом верхнем углу нажмите на иконку карты. Если неудобно искать на карте, выберите список.",,,,,,,,,,,
25,Банкоматы и офисы,Поиск офисов,МБ,All,,Как найти ближайший офис банка,,https://mobile.open.ru/#2252,https://www.open.ru/mobile_open_ru,На экране «На карте» нажмите на стрелку в нижнем правом углу для определения геолокации.,"Если геолокация недоступна, включите ее в настройках телефона.",Нажмите на иконку в правом верхнум углу экрана: чтобы выполнить фильтр по категории «Офисы».,На карте будут показаны офисы и ваше местоположение.,"Нажмите список, чтобы увидеть точный адрес офиса банка.",,,,,,,
26,Банкоматы и офисы,Поиск офисов,МБ,Android,2.43 и выше,Как узнать график работы кассы и депозитария,,,https://www.open.ru/mobile_open_ru,Перейдите на экран «На карте».,Найдите нужный офис на карте или выберите его из списка — для этого нажмите на вкладку «Список».,"Нажмите на название офиса, чтобы развернуть карточку с подробной информацией. Часы работы кассы и депозитария можно посмотреть в разделах «Работа кассы» и «График работы депозитария».",,,,,,,,,
27,Банкоматы и офисы,Поиск офисов,ИБ,,,Как найти ближайший офис банка,,,,Данная функция доступна в мобильном приложении.,,,,,,,,,,,
