332,Карты,Лимиты,ИБ,,,Как отключить лимиты по карте,,https://www.open.ru/faq#2674,,На вкладке «Мои продукты» в разделе «Карты» найдите нужную карту и нажмите «Еще».,Нажмите «Лимиты».,"Выберите, для каких операций по карте отключить лимит: все операции, покупки или снятие наличных.","Передвиньте ползунок напротив лимита, который больше не нужен.",Нажмите «Сохранить».,Введите код из SMS.,,,,,,
333,Карты,Лимиты,ИБ,,,Как отключить лимиты на снятие наличных с карты,,,,На вкладке «Мои продукты» в разделе «Карты» найдите нужную карту и нажмите «Еще».,Нажмите «Лимиты».,"В блоке «На снятие наличных» передвиньте ползунок напротив лимита, который больше не нужен.",Нажмите «Сохранить».,Введите код из SMS.,,,,,,,
334,Карты,Лимиты,ИБ,,,Как отключить лимиты на покупки по карте,,,,На вкладке «Мои продукты» в разделе «Карты» найдите нужную карту и нажмите «Еще».,Нажмите «Лимиты».,"В блоке «На покупки» передвиньте ползунок напротив лимита, который больше не нужен.",Нажмите «Сохранить».,Введите код из SMS.,,,,,,,
335,Карты,Лимиты,ИБ,,,Как отключить лимиты для всех операций по карте,,,,На вкладке «Мои продукты» в разделе «Карты» найдите нужную карту и нажмите «Еще».,Нажмите «Лимиты».,"В блоке «Общий лимит» передвиньте ползунок напротив лимита, который больше не нужен.",Нажмите «Сохранить».,Введите код из SMS.,,,,,,,
336,Карты,Дебетовая Opencard,ИБ,,,Как оформить дебетовую карту Opencard с доставкой,,https://www.open.ru/faq#1568 https://www.open.ru/internetbank#2288,https://www.open.ru/faq#1568,На вкладке «Мои продукты» в разделе «Карты» нажмите «Оформить карту».,В слайдере в новом окне выберите «Opencard Дебетовая».,Нажмите «Оформить онлайн».,"Выберите валюту и платежную систему карты, а также введите имя, которое нужно указать на карте.","Ознакомьтесь с условиями оформления, обслуживания, тарифом карты и нажмите «Детали доставки».","Укажите город, адрес, дату, время доставки и, если необходимо, оставьте комментарий. Чтобы определить адрес автоматически, разрешите браузеру доступ к вашему местоположению, а затем нажмите на стрелку в поле с адресом доставки.

Нажмите «Оформить».
  
Если в вашем городе недоступна доставка сотрудником банка, закажите доставку в офис банка.",Введите SMS-код для подтверждения.,За день до доставки вам придет SMS-сообщение с напоминанием. В день доставки позвонит представитель банка. Вы в любой момент сможете перенести дату доставки по ссылке из SMS-сообщения.,,,,
337,Карты,Дебетовая Opencard Плюс,ИБ,,,Как оформить дебетовую карту Opencard Плюс с доставкой,,https://www.open.ru/faq#1568,https://www.open.ru/faq#1568,На вкладке «Мои продукты» в разделе «Карты» нажмите «Оформить карту».,В слайдере в новом окне выберите «Opencard Дебетовая» в тёмном дизайне.,Нажмите «Оформить онлайн».,"Выберите валюту и платежную систему карты, а также введите имя, которое нужно указать на карте.","Ознакомьтесь с условиями оформления, обслуживания, тарифом карты и нажмите «Детали доставке».","Укажите город, адрес, дату, время доставки и, если необходимо, оставьте комментарий. Чтобы определить адрес автоматически, разрешите браузеру доступ к вашему местоположению, а затем нажмите на стрелку в поле с адресом доставки.

Нажмите «Оформить».
  
Если в вашем городе недоступна доставка сотрудником банка, закажите доставку в офис банка.",Введите SMS-код для подтверждения.,За день до доставки вам придет SMS-сообщение с напоминанием. В день доставки позвонит представитель банка. Вы в любой момент сможете перенести дату доставки по ссылке из SMS-сообщения.,,,,
338,Карты,Пополнение,ИБ,,,Как пополнить карту «Открытия» через Apple Pay,,,,На вкладке «Мои продукты» в разделе «Карты» найдите нужную карту.,Нажмите «Пополнить».,Выберите «С помощью Apple Pay».,Введите сумму.,Подвтердите перевод на своем устройстве. Деньги зачислятся мгновенно.,Пополнение карты через Apple Pay в интернет-банке доступно в Safari на MacOS не ниже Sierra и на iOS не ниже версии 10,,,,,,
339,Карты,Закрытие карты,ИБ,,,Как закрыть дебетовую карту,,,,На экране «Мои продукты» в разделе «Карты» найдите нужную карту.,Нажмите «Ещё».,Выберите «Закрыть карту».,Нажмите «Закрыть карту».,Подтвердите действие SMS-кодом.,"Карта заблокируется сразу после отправки заявки. Счет карты будет закрыт через 45 дней. Найти и посмотреть закрытую карту можно на вкладке «Закрытые» в разделе «Карты». 
 
 Закрыть можно только активированную карту с нулевым балансом, к которой не привязаны другие продукты (вклады, кредиты и т.д.). Для всех остальных случаев выводятся предупреждения о том, что нужно сделать, чтобы закрыть карту.",,,,,,
340,Карты,Лимиты,ИБ,,,"Как посмотреть, какую сумму от установленного лимита я уже потратил",,,,На экране «Мои продукты» в разделе «Карты» найдите нужную вам карту и нажмите «Еще».,Нажмите «Лимиты».,"Под каждым лимитом отображается шкала, которая показывает, какая сумма из заданного лимита уже израсходована и какая осталась.",,,,,,,,,
341,Карты,История операций,ИБ,,,Как найти операцию по карте в истории операций с помощью поиска,,,,Перейдите на вкладку «Мои продукты».,"На вкладке «По картам» в строке поиска введите запрос. Искать операции можно по категории, статуса, комментарию, названию магазина, организации, по номеру телефона и диапозону сумму (например, 100-200).","Ниже отобразятся операции, которые подходят под ваш запрос.",,,,,,,,,
342,Карты,Настройки приватности,ИБ,,,Как скрыть баланс карты,,https://www.open.ru/faq#2150 https://www.open.ru/credit_cards/faq#1744 ,,На экране «Мои продукты» в разделе «Карты» найдите нужную вам карту.,Нажмите на иконку глаза рядом с балансом.,"Баланс карты будет скрыт на всех экранах в интернет-банке, в том числе при совершении платежей и переводов. Включить отображение баланса можно, нажав на эту же иконку.",,,,,,,,,
343,Карты,Настройки приватности,ИБ,,,Как скрыть карту,,https://www.open.ru/faq#2151 https://www.open.ru/credit_cards/faq#1743,,На экране «Мои продукты» в разделе «Карты» найдите нужную вам карту.,Нажмите «Ещё».,Выберите «Настройки приватности».,Выберите «Скрыть карту» — передвиньте ползунок.,Нажмите «Сохранить».,"Нажмите «Понятно, скрыть».","Карта не будет отображаться в интернет-банке, но при этом доступна для операций, в том числе платежей и переводов.
 
 Найти карту и изменить настройки приватности можно в разделе «Скрытые продукты» в настройках профиля.",,,,,
344,Карты,Кредитные карты,МБ,Android,2.37 и выше,Как оформить рефинансирование кредитной карты другого банка,,,,На экране «Мои деньги» перейдите в раздел «Карты» и выберите нужную кредитную карту.,Перейдите в раздел «Настройки».,Нажмите «Рефинансировать другую карту».,"Ознакомьтесь, как работает рефинансирование и нажмите «Рефинансировать».","Укажите номер кредитной карты, которую хотите рефинансировать, введите сумму задолженнности, которую нужно погасить и нажмите «Далее».",Нажмите «Перевести».,Введите SMS-код для подтверждения операции.,"Деньги в зависимости от банка получателя зачислятся на счет в срок от нескольких минут до нескольких дней. 
 
Банк не возьмет комиссию за перевод, если в течение 92 дней после рефинансирования вы закроете кредитную карту другого банка и расторгните договор. Если этого не сделать комиссия составит 5,9% от суммы перевода плюс 590 рублей.",,,,
345,Карты,Кредитные карты,ИБ,,,Как оформить кредитную карту,,https://www.open.ru/credit_cards/faq#1048,https://www.open.ru/credit_cards/faq#1048,На экране «Мои продукты» в разделе «Карты» нажмите «Оформить карту».,"Выберите «Кредитные» в верхней части экрана. Выберите, какую карту хотите оформить, и нажмите «Продолжить».","Введите SMS-код, подтвердите согласие на обработку персональных данных и нажмите «Подтвердить код».",Проверьте и введите недостающие данные и нажмите «Подтвердить».,"Введите дополнительные данные: доход и способ его подтверждения, наличие пенсии, тип образования, город получения карты. Нажмите «Получить предварительное одобрение».",Дождитесь предварительного одобрения карты.,"Если заявка предварительно одобрена, укажите размер кредитного лимита и сведения о работе. Нажмите «Продолжить».","Выберите способ доставки карты, проверьте имя на карте и введите кодовое слово. Укажите дополнительную информацию: email, семейное положение и другие данные. Нажмите «Продолжить».",Укажите информацию о дополнительном источнике дохода и нажмите «Получить карту».,"Дождитесь SMS с решением банка. Если заявка на оформление кредитной карты одобрена, подготовьте необходимые документы — доставим карту выбранными вами способом.",,
346,Карты,Просмотр баланса,МБ,iOS,2.88 и выше,Функция больше недоступна. Как посмотреть баланс карты с помощью клавиатуры OpenKey,,https://www.open.ru/openkey#1813 https://www.open.ru/mobile_open_ru#2246 ,"https://www.open.ru/mobile_open_ru
 https://www.open.ru/openkey","Нажмите на значок глобуса (иконку смены языка) в нижнем левом углу экрана, чтобы открыть клавиатуру OpenKey.",Нажмите «Мои продукты».,В разделе «Карты» найдите нужную карту — баланс отображается над ее названием.,,,,,,,,,
347,Карты,Реквизиты,МБ,iOS,2.88 и выше,Функция больше недоступна. Как отправить реквизиты счета карты с помощью клавиатуры OpenKey,,https://www.open.ru/openkey#1812 https://www.open.ru/mobile_open_ru#2245 ,"
 https://www.open.ru/openkey","Нажмите на значок глобуса (иконку смены языка) в нижнем левом углу экрана, чтобы открыть клавиатуру OpenKey.",Нажмите «Мои продукты».,"В разделе «Карты» найдите нужную карту и нажмите «Отправить реквизиты» — реквизиты автоматически скопируются и вставятся в поле для ввода в приложении, которым вы в этот момент пользуетесь.",,,,,,,,,
348,Карты,История операций,МБ,iOS,2.88 и выше,Функция больше недоступна. Как посмотреть недавние операции по картам с помощью клавиатуры OpenKey,,https://www.open.ru/openkey#1814 https://www.open.ru/mobile_open_ru#2247,"https://www.open.ru/mobile_open_ru
 https://www.open.ru/openkey","Нажмите на значок глобуса (иконку смены языка) в нижнем левом углу экрана, чтобы открыть клавиатуру OpenKey.",Потяните снизу вверх раздел «Недавние операции» — в списке отразятся 20 последних операций по всем вашим картам.,,,,,,,,,,
349,Карты,Страхование,ИБ,,,Как застраховать карту,,,,Перейдите на вкладку «Страхование».,"В разделе программы «Защита карты» ознакомьтесь с условиями страхования и выберите, к какой карте подключить страховку.",Нажмите «Подключить».,Введите SMS-код для подтверждения.,,,,,,,,
350,Карты,Страхование,ИБ,,,Как отключить страхование карты,,,,Перейдите на вкладку «Страхование».,"В разделе программы «Защита карты» найдите карту, у которой хотите отключить страховку.","Нажмите «Отключить» справа от названия карты.

Примечание: Если отключить страховку для карты, подключить ее еще раз будет невозможно.",Введите SMS-код для подтверждения.,,,,,,,,
351,Карты,Страхование,ИБ,,,Можно ли повторно застраховать карту,,,,"Если вы отключили страхование, застраховать карту повторно не получится. Посключить эту слугой можно только для другой карты.",,,,,,,,,,,
352,Карты,Страхование,ИБ,,,"Как посмотреть, застрахована ли карта",,,,Перейдите в раздел «Карты» во вкладке «Мои продукты»,"Найдите нужную карту — иконка со статусом страховки отображается рядом с ее названием.
 
 Зеленая иконка означает, что карта застрахована по программе «Защита карты». Наведите на значок, чтобы узнать, срок действия страховки. 
 
 Желтая иконка означает, что карта не застрахована: программа «Защита карты» подключена, но не оплачена. Пополните баланс карты, чтобы продлить страховку.
 
 Серая иконка означает, что карта не застрахована: программа «Защиты карты» не подключена. Нажмите на иконку, чтобы перейти во вкладку «Страхование» и подключить страховку.",,,,,,,,,,
353,Карты,Виртуальная карта,МБ,Android,2.38 и выше,Как оформить виртуальную карту,,https://www.open.ru/faq#1566,https://www.open.ru/faq#1566,"На экране «Мои деньги» в разделе «Карты» нажмите «Оформить карту». 
 
 Примечание: Карту можно оформить в рублях, долларах и евро. Выпустить карту можно, только если есть действующая пластиковая, стоимость выпуска — 99 рублей, комиссия будет списана после первой оплаты картой. Срок действия карты — 8 лет.
 
 Для виртуальной карты доступны те же услуги, что и для пластиковой, кроме перевыпуска. Виртуальную карту удобнее всего использовать для оплаты услуг в интернете, но ей также можно расплачиваться в обычных магазинах с помощью смартфона с функцией NFC — бесконтактной оплаты. Для этого карту нужно добавить в электронный кошелек — в Apple Pay, Samsung Pay или Google play.",В слайдере в новом окне выберите «Виртуальная Opencard».,Нажмите «Оформить сейчас».,"Выберите валюту, платежную систему и ознакомьтесь с условиями оформления, обслуживания и тарифом карты.",Нажмите «Оформить».,"Заявка на оформление карты отправлена. Выпуск карты занимает 1—2 минуты. Когда карта будет выпущена, вы получите SMS-сообщение, а карта отобразится на экране «Мои деньги».",,,,,,
354,Карты,Виртуальная карта,МБ,Android,2.43 и выше,Как оформить виртуальную карту дополнительно к действующей пластиковой,,https://www.open.ru/faq#1566,,На экране «Мои деньги» в разделе «Карты» выберите нужную карту Opencard.,Перейдите на вкладку «Настройки».,Выберите «Дополнительная виртуальная карта».,Ознакомьтесь с преимуществами виртуальной карты. Нажмите «Понятно».,"Выберите платежную систему ― Visa, Mastercard или Мир. Ознакомьтесь с условиями оформления и обслуживания карты.",Нажмите «Оформить». Виртуальная карта будет выпущена в течение нескольких минут — дождитесь SMS с уведомлением о ее готовности. После этого карта появится на экране «Мои деньги».,,,,,,
355,Карты,Виртуальная карта,МБ,iOS,3.05 и выше,Как оформить виртуальную карту дополнительно к действующей пластиковой,,https://www.open.ru/faq#1566,,На экране «Мои деньги» в разделе «Карты» выберите нужную карту Opencard.,Перейдите на вкладку «Настройки».,Выберите «Дополнительная виртуальная карта».,Ознакомьтесь с преимуществами виртуальной карты. Нажмите «Понятно».,"Выберите платежную систему ― Visa, Mastercard или Мир. Ознакомьтесь с условиями оформления и обслуживания карты.",Нажмите «Оформить». Виртуальная карта будет выпущена в течение нескольких минут — дождитесь SMS с уведомлением о ее готовности. После этого карта появится на экране «Мои деньги».,,,,,,
356,Карты,Виртуальная карта,МБ,Android,2.38 и выше,Как активировать виртуальную карту,,https://www.open.ru/faq#1567,https://www.open.ru/faq#1567,На экране «Мои деньги» в разделе «Карты» найдите виртуальную карту.,Нажмите «Активир.» справа от названия виртуальной карты.,Придумайте и подтвердите PIN-код.,Введите SMS-код для подтверждения активации карты.,"Карта активирована. Вы можете ее пополнить с карты «Открытия» или другого банка, посмотреть ее реквизиты и добавить в Apple Pay или Google Pay.",,,,,,,
